{
  "$schema": "https://json-schema.org/draft/2020-12/schema",
  "$id": "urn:broker-reports:gate2:financial-decision-reason-catalog:v1",
  "title": "Broker Reports Gate 2 financial decision reason catalog v1",
  "type": "object",
  "additionalProperties": false,
  "properties": {
    "schema_version": {
      "const": "broker_reports_gate2_financial_decision_reason_catalog_v1"
    },
    "catalog_id": {
      "const": "broker_reports_gate2_financial_decision_reason_catalog"
    },
    "semantic_version": {
      "const": "1.0.0"
    },
    "managed_asset_family_id": {
      "const": "broker_reports_gate2_financial_domain_assets"
    },
    "code_contract_version": {
      "const": "broker_reports_gate2_financial_evidence_decision_v1"
    },
    "authority_status": {
      "const": "target_normative_not_live"
    },
    "runtime_activation": {
      "const": false
    },
    "lifecycle": {
      "type": "object",
      "additionalProperties": false,
      "properties": {
        "status": {
          "const": "draft"
        },
        "draft_rollback": {
          "const": "discard_without_runtime_mutation"
        },
        "active_rollback": {
          "const": "select_previous_validated_immutable_family_version"
        }
      },
      "required": [
        "status",
        "draft_rollback",
        "active_rollback"
      ]
    },
    "locale": {
      "const": "en"
    },
    "applies_to_disposition": {
      "const": "unclassified_financial_input"
    },
    "selection_metric": {
      "const": "plausible_distinct_available_financial_type_count"
    },
    "gui": {
      "type": "object",
      "additionalProperties": false,
      "properties": {
        "collection_title": {
          "type": "string",
          "minLength": 5,
          "maxLength": 120,
          "pattern": "^(?:\\S+ ){1,}\\S+$"
        },
        "item_key": {
          "const": "code"
        },
        "item_label": {
          "const": "human_title"
        },
        "order_field": {
          "const": "display_order"
        },
        "editable_fields": {
          "const": [
            "human_title",
            "meaning",
            "use_when",
            "do_not_use_when",
            "positive_example",
            "contrast_with_neighbouring_reasons"
          ]
        },
        "immutable_fields": {
          "const": [
            "code",
            "selection_boundary"
          ]
        }
      },
      "required": [
        "collection_title",
        "item_key",
        "item_label",
        "order_field",
        "editable_fields",
        "immutable_fields"
      ]
    },
    "reasons": {
      "type": "array",
      "minItems": 2,
      "maxItems": 2,
      "uniqueItems": true,
      "items": {
        "oneOf": [
          {
            "type": "object",
            "additionalProperties": false,
            "properties": {
              "code": {
                "const": "ambiguous_registry_type"
              },
              "display_order": {
                "type": "integer",
                "minimum": 1,
                "maximum": 2
              },
              "human_title": {
                "type": "string",
                "minLength": 5,
                "maxLength": 120,
                "pattern": "^(?:\\S+ ){1,}\\S+$"
              },
              "meaning": {
                "type": "string",
                "minLength": 12,
                "maxLength": 800,
                "pattern": "^(?:\\S+ ){5,}\\S+$"
              },
              "use_when": {
                "type": "string",
                "minLength": 12,
                "maxLength": 800,
                "pattern": "^(?:\\S+ ){5,}\\S+$"
              },
              "do_not_use_when": {
                "type": "string",
                "minLength": 12,
                "maxLength": 800,
                "pattern": "^(?:\\S+ ){5,}\\S+$"
              },
              "positive_example": {
                "type": "string",
                "minLength": 12,
                "maxLength": 800,
                "pattern": "^(?:\\S+ ){5,}\\S+$"
              },
              "contrast_with_neighbouring_reasons": {
                "type": "array",
                "minItems": 1,
                "maxItems": 1,
                "uniqueItems": true,
                "items": {
                  "oneOf": [
                    {
                      "type": "object",
                      "additionalProperties": false,
                      "properties": {
                        "reason_code": {
                          "const": "no_registry_type"
                        },
                        "distinction": {
                          "type": "string",
                          "minLength": 12,
                          "maxLength": 800,
                          "pattern": "^(?:\\S+ ){5,}\\S+$"
                        }
                      },
                      "required": [
                        "reason_code",
                        "distinction"
                      ]
                    }
                  ]
                },
                "allOf": [
                  {
                    "contains": {
                      "type": "object",
                      "properties": {
                        "reason_code": {
                          "const": "no_registry_type"
                        }
                      },
                      "required": [
                        "reason_code"
                      ]
                    },
                    "minContains": 1,
                    "maxContains": 1
                  }
                ]
              },
              "selection_boundary": {
                "oneOf": [
                  {
                    "const": {
                      "minimum_inclusive": 0,
                      "maximum_inclusive": 0
                    }
                  },
                  {
                    "const": {
                      "minimum_inclusive": 2,
                      "maximum_inclusive": "unbounded"
                    }
                  }
                ]
              }
            },
            "required": [
              "code",
              "display_order",
              "human_title",
              "meaning",
              "use_when",
              "do_not_use_when",
              "positive_example",
              "contrast_with_neighbouring_reasons",
              "selection_boundary"
            ]
          },
          {
            "type": "object",
            "additionalProperties": false,
            "properties": {
              "code": {
                "const": "no_registry_type"
              },
              "display_order": {
                "type": "integer",
                "minimum": 1,
                "maximum": 2
              },
              "human_title": {
                "type": "string",
                "minLength": 5,
                "maxLength": 120,
                "pattern": "^(?:\\S+ ){1,}\\S+$"
              },
              "meaning": {
                "type": "string",
                "minLength": 12,
                "maxLength": 800,
                "pattern": "^(?:\\S+ ){5,}\\S+$"
              },
              "use_when": {
                "type": "string",
                "minLength": 12,
                "maxLength": 800,
                "pattern": "^(?:\\S+ ){5,}\\S+$"
              },
              "do_not_use_when": {
                "type": "string",
                "minLength": 12,
                "maxLength": 800,
                "pattern": "^(?:\\S+ ){5,}\\S+$"
              },
              "positive_example": {
                "type": "string",
                "minLength": 12,
                "maxLength": 800,
                "pattern": "^(?:\\S+ ){5,}\\S+$"
              },
              "contrast_with_neighbouring_reasons": {
                "type": "array",
                "minItems": 1,
                "maxItems": 1,
                "uniqueItems": true,
                "items": {
                  "oneOf": [
                    {
                      "type": "object",
                      "additionalProperties": false,
                      "properties": {
                        "reason_code": {
                          "const": "ambiguous_registry_type"
                        },
                        "distinction": {
                          "type": "string",
                          "minLength": 12,
                          "maxLength": 800,
                          "pattern": "^(?:\\S+ ){5,}\\S+$"
                        }
                      },
                      "required": [
                        "reason_code",
                        "distinction"
                      ]
                    }
                  ]
                },
                "allOf": [
                  {
                    "contains": {
                      "type": "object",
                      "properties": {
                        "reason_code": {
                          "const": "ambiguous_registry_type"
                        }
                      },
                      "required": [
                        "reason_code"
                      ]
                    },
                    "minContains": 1,
                    "maxContains": 1
                  }
                ]
              },
              "selection_boundary": {
                "oneOf": [
                  {
                    "const": {
                      "minimum_inclusive": 0,
                      "maximum_inclusive": 0
                    }
                  },
                  {
                    "const": {
                      "minimum_inclusive": 2,
                      "maximum_inclusive": "unbounded"
                    }
                  }
                ]
              }
            },
            "required": [
              "code",
              "display_order",
              "human_title",
              "meaning",
              "use_when",
              "do_not_use_when",
              "positive_example",
              "contrast_with_neighbouring_reasons",
              "selection_boundary"
            ]
          }
        ]
      },
      "allOf": [
        {
          "contains": {
            "type": "object",
            "properties": {
              "code": {
                "const": "ambiguous_registry_type"
              }
            },
            "required": [
              "code"
            ]
          },
          "minContains": 1,
          "maxContains": 1
        },
        {
          "contains": {
            "type": "object",
            "properties": {
              "code": {
                "const": "no_registry_type"
              }
            },
            "required": [
              "code"
            ]
          },
          "minContains": 1,
          "maxContains": 1
        },
        {
          "contains": {
            "type": "object",
            "properties": {
              "display_order": {
                "const": 1
              }
            },
            "required": [
              "display_order"
            ]
          },
          "minContains": 1,
          "maxContains": 1
        },
        {
          "contains": {
            "type": "object",
            "properties": {
              "display_order": {
                "const": 2
              }
            },
            "required": [
              "display_order"
            ]
          },
          "minContains": 1,
          "maxContains": 1
        },
        {
          "contains": {
            "type": "object",
            "properties": {
              "selection_boundary": {
                "const": {
                  "minimum_inclusive": 0,
                  "maximum_inclusive": 0
                }
              }
            },
            "required": [
              "selection_boundary"
            ]
          },
          "minContains": 1,
          "maxContains": 1
        },
        {
          "contains": {
            "type": "object",
            "properties": {
              "selection_boundary": {
                "const": {
                  "minimum_inclusive": 2,
                  "maximum_inclusive": "unbounded"
                }
              }
            },
            "required": [
              "selection_boundary"
            ]
          },
          "minContains": 1,
          "maxContains": 1
        }
      ]
    },
    "integrity_sha256": {
      "type": "string",
      "pattern": "^[0-9a-f]{64}$"
    }
  },
  "required": [
    "schema_version",
    "catalog_id",
    "semantic_version",
    "managed_asset_family_id",
    "code_contract_version",
    "authority_status",
    "runtime_activation",
    "lifecycle",
    "locale",
    "applies_to_disposition",
    "selection_metric",
    "gui",
    "reasons",
    "integrity_sha256"
  ]
}
